content/en/raweb1.1/niveaux.json

{
    "1.1":"A",
    "1.2":"A",
    "1.3":"A",
    "1.4":"A",
    "1.5":"A",
    "1.6":"A",
    "1.7":"A",
    "1.8":"AA",
    "1.9":"A",
    "2.1":"A",
    "2.2":"A",
    "3.1":"A",
    "3.2":"AA",
    "3.3":"AA",
    "4.1":"A",
    "4.2":"A",
    "4.3":"A",
    "4.4":"A",
    "4.5":"AA",
    "4.6":"AA",
    "4.7":"A",
    "4.8":"A",
    "4.9":"A",
    "4.10":"A",
    "4.11":"A",
    "4.12":"A",
    "4.13":"A",
    "4.14":"AA",
    "4.15":"AA",
    "4.16":"AA",
    "4.17":"AA",
    "4.18":"AA",
    "5.1":"A",
    "5.2":"A",
    "5.3":"A",
    "5.4":"A",
    "5.5":"A",
    "5.6":"A",
    "5.7":"A",
    "5.8":"A",
    "6.1":"A",
    "6.2":"A",
    "7.1":"A",
    "7.2":"A",
    "7.3":"A",
    "7.4":"A",
    "7.5":"AA",
    "8.1":"A",
    "8.2":"A",
    "8.3":"A",
    "8.4":"A",
    "8.5":"A",
    "8.6":"A",
    "8.7":"AA",
    "8.8":"AA",
    "8.9":"A",
    "8.10":"A",
    "9.1":"A",
    "9.2":"A",
    "9.3":"A",
    "9.4":"A",
    "10.1":"A",
    "10.2":"A",
    "10.3":"A",
    "10.4":"AA",
    "10.5":"AA",
    "10.6":"A",
    "10.7":"A",
    "10.8":"A",
    "10.9":"A",
    "10.10":"A",
    "10.11":"AA",
    "10.12":"AA",
    "10.13":"AA",
    "10.14":"A",
    "11.1":"A",
    "11.2":"A",
    "11.3":"AA",
    "11.4":"A",
    "11.5":"A",
    "11.6":"A",
    "11.7":"A",
    "11.8":"A",
    "11.9":"A",
    "11.10":"A",
    "11.11":"AA",
    "11.12":"AA",
    "11.13":"AA",
    "12.1":"AA",
    "12.2":"AA",
    "12.3":"AA",
    "12.4":"AA",
    "12.5":"AA",
    "12.6":"A",
    "12.7":"A",
    "12.8":"A",
    "12.9":"A",
    "12.10":"A",
    "12.11":"AA",
    "13.1":"A",
    "13.2":"A",
    "13.3":"A",
    "13.4":"A",
    "13.5":"A",
    "13.6":"A",
    "13.7":"A",
    "13.8":"A",
    "13.9":"AA",
    "13.10":"A",
    "13.11":"A",
    "13.12":"A",
    "13.13":"AA",
    "13.14":"A",
    "14.1":"AA",
    "14.2":"A",
    "14.3":"AA",
    "15.1":"AA",
    "15.2":"A",
    "15.3":"AA",
    "15.4":"AA",
    "16.1":"AA",
    "16.2":"A",
    "16.3":"AA",
    "15.5":"A",
    "15.6":"A",
    "17.1":"A",
    "17.2":"A",
    "17.3":"A",
    "17.4":"A",
    "17.5":"A",
    "17.6":"A",
    "17.7":"AA",
    "17.8":"A",
    "17.9":"A",
    "17.10":"A",
    "17.11":"AA"
}

content/en/raweb1.1/notes-de-revision.md

### Summary of changes with a major impact

* Criterion 1.2 has been modified to reduce the use of `role="presentation"` and `role="none"`.
* Criterion 13.5 has been modified and no longer considers the use of the `<abbr>` tag and the `title` attribute as a compliant method for providing an alternative to cryptic content.

#### 6.2

This change accompanies the change to the glossary note [Accessible name of a link](glossaire.html#accessible-name-of-a-link), which no longer requires criteria 6.2 and 10.2 to be invalidated in cases where a link has no content between the tags. [Criterion 6.2](/en/raweb1.1/criteres#crit-6-2) now only concerns the presence of an accessible name.

#### 9.2

[Criterion 9.2](/en/raweb1.1/criteres#crit-9-2) has been modified to take into account the evolution of support by assistive technologies for HTML tags used to structure large areas of the page. It is no longer mandatory to use both an HTML5 tag and an equivalent ARIA `role`. [Criterion 12.6](/en/raweb1.1/criteres#crit-12-6) has also been modified accordingly.

#### 11.10

The tests for [criterion 11.10](/en/raweb1.1/criteres#crit-11-10) are modified: 
- to introduce optional fields in the tests (previously referenced only in specific cases); 
- to extend the possibilities for identifying mandatory fields (test 11.10.2);
- to extend the requirement to indicate input formats to all fields whose format is checked, and not only to mandatory fields (test 11.10.4);
- to change "prior to form validation" to "before entry" (tests 11.10.1, 11.10.2 and 11.10.5) in order to be able to handle cases where error management takes place when exiting a field.

#### 12.6

[Criterion 12.6](/en/raweb1.1/criteres#crit-12-6) has been modified to take into account changes in the requirements for implementing landmarks (see the [evolution of criterion 9.2](#9.2)): it is no longer mandatory to use both an HTML5 tag and an equivalent ARIA `role`.

Criterion 12.6 has therefore been modified to apply only to regions other than the main areas already identified in [criterion 9.2](/en/raweb1.1/criteres#crit-9-2).

##### In RAWeb1

Criterion 12.6: Can content grouping regions present in several web pages (header, main navigation, main content, footer and search engine) be reached or avoided?

##### In RAWeb1.1

Criterion 12.6: Can content grouping zones present on several web pages (with the exception of the main regions composing the document structure) be reached or avoided, if necessary?

#### 13.3

The specific case referred to in [criterion 13.3](/en/raweb1.1/criteres#crit-13-3) has been modified to take into account the entry into force of the [law of 8 March 2023](https://legilux.public.lu/eli/etat/leg/loi/2023/03/08/a133/jo) in order to make the exemption of office files published before 23 September 2020 conditional only on public sector bodies subject to the [law of 28 May 2019](http://legilux.public.lu/eli/etat/leg/loi/2019/05/28/a373/jo).

#### 13.5

[Criterion 13.5](/en/raweb1.1/criteres#crit-13-5) is amended to better define the scope of the criterion (the definition [Cryptic Content](glossaire.html#cryptic-content) has also been created) and the cases of implementations deemed compatible with accessibility.

##### Technical note

If cryptic content conveying information is nested within a tag with a WAI-ARIA `role="img"` attribute, it will be evaluated against criteria 1.1 and 1.3, and criterion 13.5 will be considered not applicable.

#### 13.6

[Criterion 13.6](/en/raweb1.1/criteres#crit-13-6) is modified to take into account the changes made to [criterion 13.5](/en/raweb1.1/criteres#crit-13-5).

#### 13.7

The first condition of the three tests in [criterion 13.7](/en/raweb1.1/criteres#crit-13-7) has been modified, as it was more restrictive than the standard ("less than" instead of "less than or equal to").

#### 13.8

A special case is added to [criterion 13.8](/en/raweb1.1/criteres#crit-13-8) (the words "(excluding special cases)" are added to the criterion and tests). This special case is taken from note 3 of the glossary definition <I>Control (moving or blinking content)</I>, which is deleted.

#### 14.1

A condition is added to [criterion 14.1](/en/raweb1.1/criteres#crit-14-1) and the methodology is modified accordingly.

##### In RAWeb1

16.2: The support service meets the communication needs of people with disabilities directly or through a relay service. Is this rule respected?

##### In RAWeb1.1

16.2: Each support service meets the communication needs of people with disabilities directly or through a relay service. Is this rule respected?

### Additions and deletions of new links to WCAG criteria, techniques and failures

- Criteria [4.1](criteres#crit-4-1), [4.2](criteres#crit-4-2), [4.5](criteres#crit-4-5) and [4.6](criteres#crit-4-6): [G226](https://www.w3.org/WAI/WCAG21/Techniques/general/G226)
- Criteria [4.3](criteres#crit-4-3) and [4.4](criteres#crit-4-4): [1.2.4 Subtitles (live)](https://www.w3.org/Translations/WCAG21-fr/#captions-live)
- Criterion [4.3](criteres#crit-4-3) and [4.4](criteres#crit-4-3): [G9](https://www.w3.org/WAI/WCAG21/Techniques/general/G9)
- Criteria [4.5](criteres#crit-4-5) and [4.6](criteres#crit-4-6): [F113](https://www.w3.org/WAI/WCAG21/Techniques/failures/F113)
- Criteria [5.1](criteres#crit-5-1) and [5.2](criteres#crit-5-2): [H39](https://www.w3.org/WAI/WCAG21/Techniques/html/H39).
- Criterion [9.2](criteres#crit-9-2): [ARIA4](https://www.w3.org/WAI/WCAG21/Techniques/aria/ARIA4)
- Criterion [10.7](criteres#crit-10-7): [C45](https://www.w3.org/WAI/WCAG21/Techniques/css/C45)
- Criteria [6.1](criteres#crit-6-1), [7.1](criteres#crit-7-1), [11.2](criteres#crit-11-2), [11.9](criteres#crit-11-9): [F111](https://www.w3.org/WAI/WCAG21/Techniques/failures/F111).
- Criterion [10.11](criteres#crit-10-11): [G224](https://www.w3.org/WAI/WCAG21/Techniques/general/G224), [G225](https://www.w3.org/WAI/WCAG21/Techniques/general/G225)
- Criterion [11.3](criteres#crit-11-3): [G197](https://www.w3.org/WAI/WCAG21/Techniques/general/G197)
- Criterion [12.8](criteres#crit-12-8): [H102](https://www.w3.org/WAI/WCAG21/Techniques/html/H102)
- Criterion [13.8](criteres#crit-13-8): [F112](https://www.w3.org/WAI/WCAG21/Techniques/failures/F112)